pu_id,title,transcription,translation,century,country,monastery_id,monastery
24913,"Colmar, Bibliothèque des Dominicains, Ms. 717 II; Full manuscript","Ich swester Dorothea uon Kippenheim ein conuent Swester deß wirdigen loͤblichen gotzhuß Sancti Johannis baptiste in vnderlinden zuͦ Colmar hab diß buͦch vß dem latin zuͦ tútzsch geschriben got zu lob vnd och zuͦ eren Sancto Sebastiano vnd den anderen lieben heilgen die doran stond vnd ich beger bemuͤticlich dz die alle got wellen fúr mich bitten die do werden leßen an dißem buͦch Amen); das ist nicht die in VL 2 (1980) Sp. 218 genannten Dorothea von Kippenheim OP (zu ihr die biographischen Notizen von moderner Hand 325r), sondern eine gleichnamige Schwester, die Anfang des 16. Jahrhunderts im Kloster Unterlinden lebte (VL 11 [2004] Sp. 380); rote Strichel und Überschriften, Lombarden rot, z. T. mit blauem Federwerk, blau, z. T. mit rotem Federwerk.","I, Sister Dorothea von Kippenheim, a convent sister of the venerable and praiseworthy house of God, Saint John the Baptist in Unterlinden near Colmar, have written this book from Latin into German for the praise of God and also in honor of Saint Sebastian and the other dear saints mentioned therein. I humbly ask that all who read this book may be willing to pray to God for me. Amen.",16,France,13847,"Unterlinden, Dominican, Colmar, France, 1232-
1789"
24915,"Colmar, Bibliothèque municipale, Ms. 267bis; f. 1-73v",S. Angnes wirttnerin ist disz buoch vnd hatt disz mins grosz vatters schwester geschriben angnes minsingerin von Frondeck wollehrwurttig Öptisze in dem loblichen gotzhusz zu augen.,"Sister Agnes Wirttnerin wrote this book, and she wrote it for my great-aunt, Agnes Minsingerin of Frondeck, a venerable abbess in the worthy house of God at Augsburg.",16,France,13847,"Unterlinden, Dominican, Colmar, France, 1232-
1789"
24917,"Colmar, Bibliothèque municipale, Ms. 343; Full manuscript",Bittent got fvr die schriberin Soror Elselin de Bisel,"Pray to God for the scribe, Sister Elselin of Bisel.",15,France,13847,"Unterlinden, Dominican, Colmar, France, 1232-
1789"
24919,"Cologne, Erzbischöfliche Diözesan- und Dombibliothek, 238; Full manuscript","Schreiberschluß f.272v: ""Byddet got vor suster Ayllet van Lych, dye dir boch geschreuen hayt, dat sych got over sy erbarmenwylle.""","Colophon on f.272v: “May God reward Sister Ayllet of Lych, who had this book written, that she may obtain God’s mercy.”",15,,,
24920,"Cologne, Erzbischöfliche Diözesan- und Dombibliothek, Ms. 63; Full manuscript","Her name was noted on f.86v: ""Gisbalda scripsit""
Her name was noted on f.174v: ""Gislildis scripsit""
Her name was noted on f.263v: ""Agilberta scripsit""","""Gisbalda wrote"" (on f.86v)
""Gislildis wrote"" (on f.174v)
""Agilberta wrote"" (on f.263v)",9,France,13824,"Chelles Abbey, Benedictine, Chelles, France, 660"
24921,"Cologne, Erzbischöfliche Diözesan- und Dombibliothek, Ms. 65; Full manuscript","Her name was noted on f.73v: ""Adruhic scripsit""
Her name was noted on f.151v ""Altildis scrip[sit]""
Her name was noted on f.224v: ""Gisledrudis scrip[sit]""
Her name was noted on f.289v: ""Eusebia scripsit""
One quire is missing at the end, so the last nun-scribe's name was not preserved","Her name was noted on f.73v: ""Adruhic wrote""
Her name was noted on f.151v ""Altildis wrote""
Her name was noted on f.224v: ""Gisledrudis wrote""
Her name was noted on f.289v: ""Eusebia wrote""
One quire is missing at the end, so the last nun-scribe's name was not preserved",9,France,13824,"Chelles Abbey, Benedictine, Chelles, France, 660"
24922,"Cologne, Erzbischöfliche Diözesan- und Dombibliothek, Ms. 67; Full manuscript","Her name was noted on f.105v: ""Vera scripsit""
Her name was noted on f.183v: ""Agnes scripsit""","Her name was noted on f.105v: ""Vera wrote""
Her name was noted on f.183v: ""Agnes wrote""",9,France,13824,"Chelles Abbey, Benedictine, Chelles, France, 660"
24932,"Cologne, Historisches Archiv der Stadt Köln, W* 25; Full manuscript","f.129r: ""Dese legende van desen heiligen tiendusent maertelaeren is begonnen ende voleindet int jaer ons heren doe men screiff M° CCCC ende LXXXVII suster Katrin van rade. Myn lieve moeder ick heb uch dese legende geschreven om dat ik wael weit dat ure liefste heiligen synt""","""f.129r: ""This legend of the holy ten thousand martyrs was begun and completed in the year of our Lord when one writes M° CCCC and LXXXVII, by Sister Katrin van Rade. My dear mother, I have written you this legend because I know well that your dearest saints are.""""",15,Netherlands,,
24939,"Cologne, Wallraf-Richartz-Museum, Inv.-Nr. 67-71; Full manuscript","Soror Gertrudis van dem Uorst qu[a]e hunc librum scribere incepit, sed non perfectit, quia morte pr[a]euenta est. Orate pro ipsa. (inscription appears next to miniature of Schreiberin on frag. 67, as quoted in Mattick 1984 p. 296)","“Sister Gertrude van dem Uorst, who began to write this book, but did not complete it, because she was prevented by death. Pray for her.”",14,Germany,,
24941,"Copenhagen, Kongelige Bibliotek, Gl. kgl. S. 3452 8°; Full manuscript",f.140: a.d. 1408 completus est liber iste in die Egidii abbatis scriptus per manum Cecilie de Monte humilis ancille Christi,"“In the year of our Lord 1408, this book was completed on the day of Saint Giles the Abbot, written by the hand of Cecilia de Monte, humble servant of Christ.”",15,,,
24942,"Dallas, Bridwell Library, Southern Methodist University, BRMS 155; Full manuscript","last page: ""Este libro se acabò a vii. dias del mes de Noviembre. año de quinientos xxiii. escriviole Mari. Dies de Oña, monja professa deste monasterio.""","last page: ""This book was finished on the 7th day of November in the year 1523, written by Maria Dies de Oña (a nun professed within this monastery).""",16,Spain,,
24944,"Darmstadt, Hessische Landes- und Hochschulbibliothek, 1640; Full manuscript",f.5v: Hunc librum sancte walburge Hitda abbatissa pro se suisque,“This book of Saint Walburga [was made] by Hitda the abbess for herself and for her community.”,11,,,
24945,"Darmstadt, Hessische Landes- und Hochschulbibliothek, 1912; Full manuscript","achterin: ""Item dit boec heeft ghescreven Suster Aef Heynricxdochter van Haerlem, bid voer haer om Gods willen""","""In the back: ""Also, this book was written by Sister Aef Heynricxdochter from Haarlem, pray for her for God's sake.""""",15,Belgium,,
24946,"Deventer, Athenaeumbibliotheek, 10 T 3 KL; Full manuscript",Dit boec heeft ghescreven ende gheeyndet suster griete des vrien op sancte Agnieten octava Anno domini M° cccc° lxvi° Och bidt voer haer propter deum,"This book was written and completed by Sister Griete des Vrien on the octave of Saint Agnes, in the year of our Lord 1466. Oh, pray for her, for God's sake.",15,Netherlands,29555,"Diepenveen Monastery, Regulars of St. Mary and St. Agnes, Diepenveen, Netherlands"
24948,"Deventer, Athenaeumbibliotheek, 10 V 2 KL; Full manuscript",Sayings int iaer us gentlemen M.CCCCC and xxij on sunte claren auent. God have this praise in the ewicheit Amen. Diet reads that pray for God's sake for that poor sister who has this song.,"Sayings in the year of our Lord 1522 on Saint Clare's eve. God have this praise in eternity. Amen. Whoever reads this, pray for God's sake for that poor sister who possesses this book.",16,Netherlands,,
22787,"Deventer, Athenaeumbibliotheek, 101 D 13 KL; Full manuscript","f.150v: ""Hier eynden die sermoenen des somers vanden hoechtiden. Ghescreven int jaer ons heren M cccc ende lj. Deo gracias.","f.150 verso: ""Here end the sermons of the summer for the high holy days. Written in the year of our Lord 1451. Thanks be to God.""",15,Netherlands,29555,"Diepenveen Monastery, Regulars of St. Mary and St. Agnes, Diepenveen, Netherlands"
24951,"Deventer, Athenaeumbibliotheek, 101 D 14 KL; Full manuscript","f.IIr: ""Dit boeck hoert ten dyepenveen int cloester by deuenter"". - Aantekening op f.219r(=221r): ""Dit is dat derde stucke der sermoenen. des eerweerdigen deuoete prior van thabor gheheten brueder beernt arboestier. Ende is vol screuen m cccc liij Deo gratias"".","f.II recto: ""This book belongs to Diepenveen in the convent near Deventer.""
Note on f.219 recto (=221 recto): ""This is the third part of the sermons of the venerable and devout prior of Thabor called Brother Beern Arboestier. And it is fully written in the year 1453. Thanks be to God.""",15,Netherlands,29555,"Diepenveen Monastery, Regulars of St. Mary and St. Agnes, Diepenveen, Netherlands"
24952,"Deventer, Athenaeumbibliotheek, 101 D 4 KL; Full manuscript","f.1v: ""Dit boeck hoert den susterenbynnen deuenter in Sunte vrsulen huus"". - Colofon op f.178r: ""Dit boeck hoert toe den susteren in sunte vrsulen huus bynnen deuenter. Een aue maria om godes wil voer die arme scriuester"".","f.1 verso: ""This book belongs to the sisters within Deventer in Saint Ursula's house.""
Colophon on f.178 recto: ""This book belongs to the sisters in Saint Ursula's house within Deventer. A Hail Mary for God's sake for the poor scribe.""",15,Netherlands,,
24953,"Deventer, Athenaeumbibliotheek, 101 D 9 KL; Full manuscript","Aantekening op f.2r (rubriek): ""Dit boeck hoert den susteren in sunte vrsulen huys toe deuenter inder beghinen strate"". - Aantekening op f.57v (rubriek): ""Dit boeck hoert den susteren in sunte vrsulen huys toe deuenter. Inder beghinen strate"". - Aantekeningen op f.193r (rubriek): ""Dit boeck is geeyn[sic] op die octaue van sunte laurens [is dit boeck geeyndet, doorgehaald]."" en ""Int iaer ons heren dusent iiii hondert l.xxiiii."" en ""Biddet om godes wil een. Aue maria voer die arme scriuester. [die dit scref..., doorgehaald]"" en ""Dit boeck hoert den susteren in sunte vrsulen huys toe deuenter inder beghinen strate"". - Vormde op grond van band en inhoud waarschijnlijk een set met Deventer, SAB : 101 D 8 KL (I, 38).","Annotation on f.2 recto (rubric): ""This book belongs to the sisters in Saint Ursula's house in Deventer, in the Beguine street.""
Annotation on f.57 verso (rubric): ""This book belongs to the sisters in Saint Ursula's house in Deventer, in the Beguine street.""
Annotations on f.193 recto (rubric): ""This book was finished on the octave of Saint Lawrence [this book was finished, crossed out]."" and ""In the year of our Lord one thousand four hundred twenty-four."" and ""Pray for the sake of God once. Hail Mary for the poor scribe. [who wrote this..., crossed out]"" and ""This book belongs to the sisters in Saint Ursula's house in Deventer, in the Beguine street.""
Based on the binding and content, likely formed a set with Deventer, SAB: 101 D 8 KL (I, 38).",15,Netherlands,,
24955,"Deventer, Athenaeumbibliotheek, 101 E 11 KL; Full manuscript","f.335v: ""Biddet voer diegene die dit gescreuen heeft want sie in voelen gebreken gebleuen is Een Aue Maria"". - Notitie op f.Iv: ""Dijt boeck hoert toe Elijzabeht Wijthagens"".","f.335 verso: ""Pray for the one who has written this, for she has remained in many faults. A Hail Mary.""
Note on f.IV: ""This book belongs to Elizabeth Wijthagens.""",16,Netherlands,29555,"Diepenveen Monastery, Regulars of St. Mary and St. Agnes, Diepenveen, Netherlands"
24959,"Deventer, Athenaeumbibliotheek, 101 E 26 KL; Full manuscript","(f.iir): ""Dit bock heeft ghescreuen suster griet essinchghes ende gheendet op des hillighen cruces dach Exaltacio Anno domini M vc xxiiij"".
Note by copyist on the first original front endpaper (f.ir): ""Liber""en ""Liber monasterij beate marie in dyepenvenn ordinis Regularissarum sancti Augustini""","f.ii recto: ""This book was written by Sister Griet Essinchghes and completed on the day of the Exaltation of the Holy Cross in the Year of our Lord 1524.""
Note by the copyist on the first original front endpaper (f.i recto): ""The book"" and ""The book of the monastery of Blessed Mary in Diepenveen, of the Order of the Most Regular Sisters of Saint Augustine.""",16,Netherlands,29555,"Diepenveen Monastery, Regulars of St. Mary and St. Agnes, Diepenveen, Netherlands"
24961,"Deventer, Athenaeumbibliotheek, 101 F 15 KL; Full manuscript","Dating based on the following: f.97r en 182r. - Aantekening op schutblad voorin, f.IIv: ""Dit boeck hoert toe deuenter In sunte vrsulen huys of anders geheiten brandes huys"". - Aantekening op f.97r: ""Int [sic] ons heren .m.cccc.ende.lix."". - Aantekening op f.182r: ""Dit boeck hoert tho den susteren van sunte vrsulen huys. Anders gheheiten brandes huys bynnen deuenter Dit is ghescreuen Int iaer ons heren M.cccclix."".","Note on the front flyleaf, f.II verso: ""This book belongs to Deventer, in Saint Ursula's house or otherwise called Brandes house.""
Note on f.97 recto: ""In the year of our Lord 1459.""
Note on f.182 recto: ""This book belongs to the sisters of Saint Ursula's house. Otherwise called Brandes house within Deventer. This was written in the year of our Lord 1459.""

Based on these notes, the book was written and belonged to Saint Ursula's house, also known as Brandes house, in Deventer, in the year 1459.",15,Netherlands,,
24962,"Deventer, Athenaeumbibliotheek, 101 F 16 KL; Full manuscript","Ir: ""Dit boec hoert int cloester ten dyepenveen by deuenter"". - Aantekening op f.242v: ""Hier eyndet dat vierde stucke der sermoenen. des eerweerdigen deuoete prior van thabor. ghenoemt brueder beernt arboestier. Ende is gescreuen m cccc liiij Deo gracias Bidet vmmer voer suster adriaen mant. die dit gescreuen heeft om gods wil want si seer behoeftich is. In hoeren leuen die gracie gods, na hoerre doot sine bermherticheit."".","f.I recto: ""This book belongs to the monastery at Diepenveen near Deventer.""
Note on f.242 verso: ""Here ends the fourth part of the sermons of the venerable and devout prior of Thabor, called Brother Beern Arboestier. And it is written in the year 1454. Thanks be to God. Pray always for Sister Adriaen Mant, who has written this for the sake of God because she is very needy. May she receive the grace of God in her life, and after her death, His mercy.""",15,Netherlands,29555,"Diepenveen Monastery, Regulars of St. Mary and St. Agnes, Diepenveen, Netherlands"
24963,"Deventer, Athenaeumbibliotheek, 101 F 17 KL; Full manuscript","Aantekeningen op f.168r: ""Dit waert gescreuen int iaer ons heren. m cccc l x"" en ""Dit boeck hoert toe den susteren bynnen deuenter van brandes huus den eluen m megeden"".","Annotations on f.168 recto: ""This was written in the year of our Lord 1450."" and ""This book belongs to the sisters within Deventer of Brandes house, commemorated on the 11th of May.""",15,Netherlands,,
24964,"Deventer, Athenaeumbibliotheek, 101 F 2 KL; Full manuscript","f.121r: ""Hier eyndet een stuck der bedudinghe op cantica canticorum coninc salomons. Gghescreven int jaer ons heren dusent vierhondert ende xxvi op der X[m] martalaren dach Deo laus""","f.121r: ""Here ends a section of the interpretation of the Song of Songs of King Solomon. Written in the year of our Lord one thousand four hundred and twenty-six, on the tenth day of the martyrs. Thanks be to God.""",15,Netherlands,29555,"Diepenveen Monastery, Regulars of St. Mary and St. Agnes, Diepenveen, Netherlands"
24966,"Deventer, Athenaeumbibliotheek, 101 F 3 KL; Full manuscript","Datering gebaseerd op colofons op f.143v en 171r, f.1-143 zijn gekopieerd in 1462, f.144-171 in 1464. - Aantekeningen op f.143v, beide in rubriek: ""Dit is ghescreuen inden iaer ons heren m cccc.lxij bynnen die octaue van paesschen ist gey [doorgehaald] geyndet. Biddet om die mynne godes voer die arme scryfster die dit scref want sie in voelen gebreken bleef""en ""Dit boeck hoert tot sunte vrsulen huus wilneer gheheiten kersteken brandes bynnen deuenter"". - Aantekeningen op f.171r: ""Dit boeck is gheeyndet bynnen die octaue van paesschen. Int iaer ons heren .m.cccc lx iiij. Biddet om godes wil voer die arme scriuester die dit screef want sie in voel gebreken bleef"" en ""Dit hoert te deuenter in sunte vrsulen huus inder beghinen strate"".","Dating based on colophons on f.s 143 verso and 171 recto; f.s 1-143 were copied in 1462, f.s 144-171 in 1464.
Annotations on f.143 verso, both in rubric: ""This was written in the year of our Lord 1462 within the octave of Easter it was finished. Pray for the love of God for the poor scribe who wrote this because she remained in many faults"" and ""This book belongs to Saint Ursula's house, commonly known as Kersteken Brandes, within Deventer.""
Annotations on f.171 recto: ""This book was finished within the octave of Easter. In the year of our Lord 1464. Pray for the sake of God for the poor scribe who wrote this because she remained in many faults"" and ""This belongs to Deventer in Saint Ursula's house in the Beguine street.""",15,Netherlands,,
24967,"Deventer, Athenaeumbibliotheek, 101 F 5 KL; Full manuscript","118v-119r: ""Bidt omme godes willen voer mii arme sundersche die dit boec ghescreuen heeft dat si hoer bekieren moet tot onsen lieuen heren [met andere hand:] suster grete van houdaen"".","118 verso - 119 recto: ""Pray for the sake of God for me, poor sinner, who has written this book, that she must repent to our dear Lord. [With another hand:] Sister Grete van Houdaen.""",15,Netherlands,29555,"Diepenveen Monastery, Regulars of St. Mary and St. Agnes, Diepenveen, Netherlands"
24969,"Deventer, Athenaeumbibliotheek, 101 F 7 KL; Full manuscript","256r: ""Bidt om gods wil voer die arme dierne die dit screef.want sie in vele gebreken bleef.Een cort gebedeken"" en ""Ghe eindet int iaer ons heren dusent vier hondert ende lxvj"".","256 recto: ""Pray for God's sake for the poor servant who wrote this, because she remained in many faults. A short prayer."" and ""It ends in the year of our Lord one thousand four hundred and sixty-six.""",15,Netherlands,29555,"Diepenveen Monastery, Regulars of St. Mary and St. Agnes, Diepenveen, Netherlands"
24970,"Deventer, Athenaeumbibliotheek, 11 F 3 KL; Full manuscript","66v: ""Iste liber scriptus est per manus soror daye Aue maria et pertinet in scolis"".","66 verso: ""This book was written by the hand of Sister Daye. Hail Mary and it belongs in the schools.""",15,Netherlands,29555,"Diepenveen Monastery, Regulars of St. Mary and St. Agnes, Diepenveen, Netherlands"
24973,"Dresden, Saechsische Landesbibliothek, M 291; Full manuscript","f.334r: ""Dit boeck is gheeyndet op sunte Magnus dach des avents toe vijff uren doer .s. Ghese ten broeke een nonne toe zelwert int cloester voer die devote suster Anne tyddinghes soe welt ghebruket die bidde om godes willen voer hem beyden""","f.334r: ""This book was completed on the eve of Saint Magnus at five o'clock by Sister Gese ten Broeke, a nun herself, in the convent, for the devout Sister Anne Tyddinghes, who desires to use it; pray for both of them for God's sake.""",16,Netherlands,,
24974,"Dresden, Saechsische Landesbibliothek, M.283; Full manuscript","30r: [ Dysß bu e chly han ich arme swo e ster Vrsul Schanfiggin v i ch allen minen minen [!] reht lieben mu e tren vnd swo e stren ze sant Katrinen ze Nu e renberg von gro u sser minn vnd tru i w geschriben han [!] , [30v] vnd beger mit ganczem herczen, das ir min alzit ernstlich vnd getrw i lich gedenkint vnd fu i r mich bittent vnd fu i r miner hertz lieben mu o ter selgen sel vnd fu i r v i nsers erwirdigen getru i wen vatter meister Hansen selgen sel. Vnd vernement ir minen to u d, ach so lo u nd v i ch min armen ellenden sel durch got getru i lich alzit beuolhen sin.]","On f.30r: ""This little book, I, poor Sister Ursula Schanfiggin, have written with great love and faithfulness for all my dear sisters and sisters at Saint Catherine's in Nuremberg. I beg with all my heart that you always remember me earnestly and faithfully and pray for me and for my dear departed mother's soul, and for our revered faithful father, Master Hans, who has passed away. And if you hear of my death, oh then, I commend my poor wretched soul faithfully to God.""",15,Germany,,
24977,"Düsseldorf, Universitäts- und Landesbibliothek, B 38; Full manuscript","f.233r: Finitus et completus est liber iste per nos sorores Katterinam de Westhoven priorissam et Annam Kyttelers et Katrinam Regis. Anno Domini M° CCCC° LXXIII° circa tempus illud, quando regnavit pestis epidemii","On f.233r: ""This book was finished and completed by us, Sisters Katherine de Westhoven, prioress, Anna Kyttelers, and Katherine Regis, in the year of our Lord 1473, around the time when the epidemic plague reigned.""",15,Germany,,
24980,"Düsseldorf, Universitäts- und Landesbibliothek, B 44; Full manuscript","Explicit Vita sancti Bernardi abbatis.‹ Scripta per manus sororis Elyzabeth de Strabach ordinis Cisterciensis, monialis professe in Rubo divi Georgii martiris","""Here ends the Life of Saint Bernard, Abbot. Written by the hand of Sister Elizabeth of Strabach, Cistercian nun professed in the Monastery of Saint George the Martyr.""",15,Germany,,
24983,"Eichstätt, Stiftsbibliothek St. Walburg, Cod. germ. 5; Full manuscript",f.236v: Item das puch ist voldent worden da man zalt 1400 und in dem 89. jar und hat gescrhiben Swester Margaret Zürlin und begert durch got ein Ave Maria.,"“Also, this book was completed in the year 1489, and it was written by Sister Margaret Zürlin. She asks, for God’s sake, for an Ave Maria.”",,,,
24985,"Eichstätt, Universitätsbibliothek, Ms. st 760; Full manuscript","(228v) Darby auch gedencken schryberin dis büchlins in dem ein jetlicher mensche lere vnd
vnderwysung gnug findt alles des er begert vff welchen sinn oder wege ers will alles bewert von den
heilligen götlichen lerern besunder vnsers heilligen vnd engelschen lerers sant Thoma von Aquin vs dem
es aller meist genumen ist","(228v): “Here the scribe of this little book should also be remembered. In it, every person can find enough instruction and teaching, according to whatever purpose or path they desire, all based on the teachings of the holy divine doctors, especially our holy and angelic teacher, Saint Thomas Aquinas, from whom most of the content is taken. It was written by a scribe from Reutin, in the hand of Barbara von Rottenburg, and completed on June 29, 1507",15,Germany,,
24987,"Einsiedeln, Stiftsbibliothek, Ms. 652; Full manuscript","f.150r: Bitten got fur die bössen schriberinen sch. Katherina von Karpfen, amen.",f.150r: Pray to God for the sinful scribe Sister Katherina von Karpfen. Amen.,16,Germany,,
24989,"Einsiedeln, Stiftsbibliothek, Ms. 654; Full manuscript","Bitten got fu""r die bo""ssen schriberinen sch. Katherina von Karpfen, amen. (CMO) bitten got fu""r die bo""sen schriberinen sch(wester) Katharina von Karpfen, amen (SMAH V/153)","Pray to God for the sinful women scribes, Sister Katherina von Karpfen. Amen.",16,Germany,,
24991,"Einsiedeln, Stiftsbibliothek, Ms. 657; Full manuscript",Bitt Gott für die arme Schriberin,Pray to God for the poor woman scribe,,,,
24992,"Einsiedeln, Stiftsbibliothek, Ms. 661; Full manuscript",Diss buechle gehörtt minen in gott geliebten trüwn frommen andächtigen gaistlichen tochttren üwer unwürdigen fro Elisabett Filingerin suppriorin und fro Künigund Zumermenin von mir üwer unwürdigen emvotter zuo s. Claren in Vilingen schw. Efrosina Som (?) scripsit.,"“This little book belongs to my beloved in God, true, pious, and devout spiritual sisters, under the unworthy hand of Sister Elisabett Filingerin, Subprioress and Sister Küningund Zumermenin from my unworthy mother at S. Claren in Villingen, Swabia. Efrosina (?!) wrote it.”",,Germany,,
24993,"Einsiedeln, Stiftsbibliothek, Ms. 671 (655); Full manuscript","106v: Hoͤr fil vnd wenig sag / antwort nüt vf all frag / lüg scheident früntschaft fil / da man den lügen gloͮben wil. - Dis wart vs geschriben an sant johans baptisten abent do man zalt M cccc vnd xlviiij yar (1449, Juni 23) von schwester angnes foͤisinen. 1449.
164v: gedenkent min durch got schwester angnes (foͤisin zuͦ sant frennen. zürich).","""106v: Listen much and say little, answer nothing to every question, trust a lie, sever friendship greatly, where one believes the lie. - This was written on the eve of Saint John the Baptist, in the year 1449, by Sister Agnes Foͤisinen. 1449.
164v: Remember me in God's grace, Sister Agnes (Foͤisin) in Saint Frennen, Zurich.""",15,Switzerland,,
24995,"Einsiedeln, Stiftsbibliothek, Ms. 752 (746); Full manuscript","357r [Lang]): Do man zalt von der geburt unsere heren Christi 1483 an s. Silvestertag han ich Dorothe von Hof dis buoch ungeschriben und bin davor ze herbst an s. Frenentag im 1482 iar alt gesin 24 iar und ist gesin nün iar an s; Pallus bekert im 83 iar, das Jerg und ich elich zesamen kamen. Liebe überwint alle alle ding. Deo gratias. Item und do ich alt bin gesin 19 iar uf s. Verenatag, do gieng ich uf des hl. crütztag nächst darnach genden Einsideln uf ain engelwiche und Satz do den sturtz uf und let etliche weltliche claider und clainet hin, das ich yr nit me truog.","357r (Lang): ""Dorothea von Hof""",15,,,
24998,"Escorial (El), Real Biblioteca de San Lorenzo, a. I. 13; Full manuscript",f.185v: O vos omnes qui legeritis hunc codicem mementote //// clientula et exigua Leodigundie qui hunc scripsi in monasterio Bobatelle regnante Adefonso principe in era 950 quisquis pro alium oraverit semetipsum deum (domino?) commendat.,"“O all you who shall read this book, remember the little servant and humble one, Leodigundie, who wrote this in the monastery of Bobatelle, during the reign of Prince Alfonso, in the era 950 (1012 CE). Whoever prays for another commends himself to the Lord (or to God).”",10,Spain,,
24999,"Escorial (El), Real Biblioteca de San Lorenzo, e. IV. 7; Full manuscript",f.57: Explicit expliceat. Scriptrix deo gratias. Que me scribebat. Gertrudis nomen habebat.,“It is finished. May it be explained. The scribe gives thanks to God. She who wrote me had the name Gertrude.”,14,,,
