pu_id,title,transcription,translation,century,country,monastery_id,monastery
22488,"Paris, Bibliothèque de l'Arsenal, Ms. 2075; full manuscript","« Explicit la benoites Passion de Nostre Seigneur Jhesu Crist, qui fut escripte et copulée l'an de graice Nostre Seigneur M IIIIc IIIIxx et VI, le jour de feste saint Gregoire, a la louuange (sic) et a l'asaucement du hault nons de Jhesus, et pour bien, profit et augmentaction de l'ame et du corps de très excellant et nobles dame Ysabiaulz de Croy, escripte par ma propre mains, suer Barbe Wyesse, religieuse indigne du couvent de Sainte Clare, cituée au Nuefchastelz, en Lorraine. » f.138v","""Here ends the blessed Passion of Our Lord Jesus Christ, which was written and completed in the year of the grace of Our Lord 1496, on the feast day of Saint Gregory, to the praise and exaltation of the high name of Jesus, and for the well-being, profit, and enhancement of the soul and body of the most excellent and noble lady Ysabiaulz de Croy, written by my own hands, Sister Barbe Wyesse, unworthy nun of the convent of Saint Clare, situated in Neufchâteau, Lorraine."" (f.138v)",15,France,,
25474,"Paris, Bibliothèque de l'Arsenal, Ms. 424; Full manuscript",f.313v: Item dit boexken is gheeint int iaer ons Heren MCCC en[de] XCIII op den avont der besnidenisse ons Heren... mij s. Ghertruit Bay bidt om Gods wil voer mijn siele.,"Also, this little book was completed in the year of our Lord 1393 on the eve of the Circumcision of our Lord... me, Sister Ghertruit Bay, prays for the sake of my soul.",15,Belgium,,
22855,"Paris, Bibliothèque de l'Arsenal, Ms. 8201; Full manuscript","f.154: Item, desen bouc heeft ghescreven suster Mergriete van den Perboen te harer 69 iaren ende ghehent te harer 70 iaren int iaer Ons Heren 15 ende 16 up die octave van Allen Heleghen, die doen lach up den saterdach, bidt voer haer.","“Item, this book was written by Sister Margriete van den Perboen at the age of 69 and completed at the age of 70, in the year of Our Lord 1516, on the octave of All Saints’ Day, which fell on a Saturday. Pray for her.”",16,,,
25475,"Paris, Bibliothèque de l'Arsenal, Ms. 8208; Full manuscript","f.161r - kopiiste: ""Dit boeck wert voleynt int jaer ons heren M cccc ende lxvij byder hant suster geertruyt vasteersts"" 
f.175r: ""Suster Gheertruit Vastaerts""","""f.161r - copyist: ""This book was completed in the year of our Lord 1467 by the hand of Sister Geertruyt Vasteersts.""
f.175r: ""Sister Geertruit Vastaerts""",15,Netherlands,,
25476,"Paris, Bibliothèque de l'Arsenal, Ms. 8227; Full manuscript","Dit boeck es ghescreven van mij suster Janneken Hubrechts ... Ick y aermme suster ben overleden a. 15(85) den (26 merts) (f.316v)
a. 1578 in der maent augustus (f.640)","“This book is written by me, Sister Janneken Hubrechts … I, a poor sister, passed away in the year 1585, on the 26th of March (f.316v).
In the year 1578, in the month of August (f.640).”",16,,,
25477,"Paris, Bibliothèque de l'Arsenal, Ms. 8228; Full manuscript",Suster Elisabeth der Moeien,,15,,,
25480,"Paris, Bibliothèque Mazarine, Ms. 432; Full manuscript","On the interior of the lower cover of the binding: « Hoc temporale scripsit atque complevit soror Margareta Bruunruwe, monialis professa VIIa domus Syon in Brugis, ordinis dive virginis Marie de Monte-Carmeli, et illuminavit soror Cornelia de Wultinchkercke, ejusdem domus et ordinis monialis professa XIIII, anno Domini XCc, V, XI die mensis octobris. O vos presentes et subsequentes, imitamini ocia earum et oretis pro eis. »","On the interior of the lower cover of the binding: ""This temporal [book] was written and completed by Sister Margareta Bruunruwe, professed nun of the seventh house of Syon in Bruges, of the order of the blessed Virgin Mary of Mount Carmel, and illuminated by Sister Cornelia de Wultinchkercke, professed nun of the same house and order, on the 11th day of October in the year of our Lord 1195. Oh you present and future ones, imitate their leisure and pray for them.""",16,Belgium,,
25481,"Paris, Bibliothèque Mazarine, Ms.781; Full manuscript","f.222v: « Item int iaer ons liefs Heeren doemmen screef XVc en̅ LXXIIII, was dit boeck volscreuen, den XXVIIIsten in junius, in der vigilien van sinte Peeten en̅ sinte Pauwels, die heyleghe apostolen, van mii suster Margrieten der Weduwen een erm professie nonne, tot Bruesel, in Sinte Elizabetten clooster op de Berch van Syon. »","""Also, in the year of our dear Lord, one thousand five hundred and seventy-four, this book was completed on the twenty-eighth of June, on the vigil of Saint Peter and Saint Paul, the holy apostles, by me, Sister Margrieten der Weduwen, a poor professed nun, at Brussels, in the Saint Elizabeth's convent on the Mount of Zion.""",16,Belgium,,
25487,"Paris, Bibliothèque nationale de France, BnF Français 580; Full manuscript",« A tres excellent Redoubtee & puissant et tres princesse. Ma dame ysabel Royne de France ...- ... Escript le ve jour d'octombre. l'an de grace mil iiij C et/ cinq. Vostre treshumble obeissant Creature/ cristine de Pizan. Prennez en gré s'il vous plaist cest escript / De ma main fait aprés mienuit une heure / Noble seigneur pour qui je l'ai escript / Prennez en gré / Quant vous plaira mieulz vous sera rescript / Mais n'avoye nul autre clerc a l'eure / Prennez en gré s'il...» (f.53r),"f.53r: “To the most excellent, revered, powerful, and most noble princess,
My lady Isabel, Queen of France…

Written on the eve of October, in the year of grace 1405.

Your most humble and obedient servant,
Christine de Pizan.

Please accept this writing, if it pleases you,
Made by my own hand after midnight, at one o’clock.
Noble lord, for whom I have written it,
Please accept it.
When it pleases you, it can be copied more finely.
But I had no other clerk at the time—
Please accept it…”",15,France,,
25483,"Paris, Bibliothèque nationale de France, Français 1533; Full manuscript","f.265v : ""Ce livre fut ... ma dame Agnes de Bourgogne, ...""","""f.265v: ""This book was ... my lady Agnes de Bourgogne, ...""",13,France,,
25486,"Paris, Bibliothèque nationale de France, Français 342; Full manuscript","Colophon: 'Cil roumans fu par ecrit en lan del incarnation notre segnor Mil deus Cens et sixante et quatorse, le semedi Apries les octaues de le trinite [Saturday, 9 June 1274]. Pries pour celi ki lescrist'. Celi is usually a female form (in contrast to celui).","Colophon: 'This romance was written in the year of the incarnation of our Lord one thousand two hundred and sixty-four, on Saturday after the octave of the Trinity [Saturday, 9 June 1274]. Pray for she who wrote it.' Celi is usually a female form (in contrast to celui).",13,France,,
25488,"Paris, Bibliothèque nationale de France, Français 817; Full manuscript",f.190v: Et fu achave ledit livre le 19 jour de descembre lan 1465. Maguerite de Chauvigny.,f.190v: And this book was finished on the 19th day of December in the year 1465. Marguerite de Chauvigny.,15,France,,
25493,"Paris, Bibliothèque nationale de France, Latin 11969; Full manuscript","Explicit compendium theologice virtutis (sic). Deo dicimus gratias. Scriptum per Henrietam anno Domini M°CCCLVI (the name and date are difficult to read due to ink smudges). Another mention of the copyist, in her own hand, is found in the upper margin of f.1r: Perscriptum a Henrieta de Lathilliaco, anno LV (not a clear reading), iovis post festum beati Luce (22 October 1355). The reasons for the transcription are explained on the same f.1r:Incipit compendium theologie sancti Thome de Aquino, hic subscriptum interlineariter, ne pargamenum sit occiosum.","Explicit Compendium Theologicae Virtutis (sic). We give thanks to God. Written by Henrietta in the year of our Lord 1356 (the name and date are difficult to read due to ink smudges).

Another mention of the copyist, in her own hand, is found in the upper margin of f.1r: Written by Henrietta of Lathilliaco, in the year 55 (not a clear reading), on Thursday after the feast of Saint Luke (22 October 1355).

The reasons for the transcription are explained on the same f.1r: Here begins the Compendium of Theology by Saint Thomas Aquinas, transcribed here interlinearly, so that the parchment may not remain idle.",14,France,,
25499,"Paris, Bibliothèque nationale de France, Latin 12949; Full manuscript",f.52: scripturae finem sibi quaerunt hic ysagogae parva quidem moles magna sed utilitas Icpa hunc scripsi glossans utrumque libellum quod logicae si sit scire legens poterit.,"“The end of writing is sought here by these small introductions; though small in size, they are of great usefulness. I, Icpa, wrote and glossed this little book, so that whoever wishes to know logic may learn by reading.”",9,,,
25503,"Paris, Bibliothèque nationale de France, Latin 17185; Full manuscript",f.291Explicit... Commenciet par moy Jenne le Fevre le 21 iour docoust an 1503 et perfet le 27 iour de septembre ensyvant et est a moy.,"“Completed … Begun by me, Jenne le Fevre, on the 21st day of August in the year 1503 and finished on the 27th day of September following, and it belongs to me.”",16,France,,
25504,"Paris, Bibliothèque nationale de France, Latin 17323; Full manuscript",f.385. Cf.photos,,16,Italy,,
25511,"Paris, Bibliothèque nationale de France, Latin 7560; Full manuscript",f.54. Εογενυα,f.54. Eugenia,9,France,,
25513,"Paris, Bibliothèque nationale de France, NAL 348; Full manuscript","f.134v: ""Quorum uel quarum nomina hic scripsi meritis peto in celis adscribi. Elsendis.""","""Whose names, whether of one or more, I have written here, I ask to be enrolled in heaven for their merits. Elsendis.""",11,France,,
25514,"Paris, Bibliothèque nationale de France, NAL 772; Full manuscript","f.21: ""XIIII. k1. [Octobris]: Soror Christina que scripsit hunc librum.""","""14th day before the kalends of October: Sister Christina who wrote this book.""",14,Germany,,
22312,"Parma, Biblioteca Palatina, Palatino 23; Full manuscript","Explicit liber iste per me suora Cleophe moniali Paradissi. Scripto negli anni della incarnatione del nostro signore (Yesu) (Christo) M CCCCC dicianove, si compié di scrivere a dì XV di março. Laus Deo sit semper. Amen.","This book is finished by me, Sister Cleophe, nun of the Paradiso. Written in the year of the incarnation of our Lord Jesus Christ 1520, completed on the 15th day of March. Praise be to God always. Amen.",16,Italy,12099,"Santa Brigida del Paradiso, Brigittine, Florence, Italy"
22416,"Parma, Biblioteca Palatina, Palatino 84; Full manuscript","f.144vB in hand of Raffaella: “Finito è il presente libro scripto per mano d’una monacha indegnamente consecrata nel monasterio del Paradiso, il cui nome sia scripto nel libro della vita, a dì quatordici di dicenbre M CCCC LXXVII. A llaude (et) gloria della somma (et)d eterna sapientia. Deo gratias. Poi ch’ài letto il libro (et) la visione coll’altre cose che qui sono scripte priega per me misera, peccatore. Dà il cuore a Dio intero (et) non diviso se gustar vuogli questo libro sancto (et) rendilo al monasterio del Paradiso”","f.144vB, in the hand of Raffaella: ""Finished is this present book written by the hand of a nun, unworthily consecrated in the monastery of Paradiso, whose name is written in the book of life, on the fourteenth day of December 1477. To the praise and glory of the highest and eternal wisdom. Thanks be to God. After you have read the book and the vision with the other things written here, pray for me, a miserable sinner. Give your heart entirely to God if you wish to taste this holy book, and return it to the monastery of Paradiso.""",15,Italy,12099,"Santa Brigida del Paradiso, Brigittine, Florence, Italy"
22491,"Pavia, Biblioteca Universitaria, Aldini 353; full manuscript",Laus Deo Omnipotenti et Santissime matri eius Virgini Marie soror Luchina decisit hoc hopus [sic],"Praise be to Almighty God and to His most holy Mother, the Virgin Mary. Sister Luchina completed this work.",15,Italy,,
25525,"Perugia, Biblioteca Comunale, 1086; Full manuscript",f.97: In Monte Luce scripto. Qui scrissit scribat sorori Eufrasie vivat in celis semper cum dno felix,"f.97: Written in Monte Luce. May he who wrote this write for Sister Eufrasia, may she live forever in the heavens with the Lord, happy.",Unknown,Italy,12375,"Saint Maria de Monteluce, Benedictine, Monteluce (Monte Lucido), a suburb of Perugia, Italy, 1222"
25532,"Perugia, Biblioteca Comunale, 1108; Full manuscript","f.109: Scripto nel Monasterio de Sancta Maria de Mont Luce nel 1510 etc. per me sora Felicita de Peroscia indigna, sora de sancta Chiara","“Written in the Monastery of Santa Maria de Mont Luce in 1510, etc., by me, Sister Felicita of Perugia, unworthy, Sister of Saint Clare.”",16,Italy,12375,"Saint Maria de Monteluce, Benedictine, Monteluce (Monte Lucido), a suburb of Perugia, Italy, 1222"
25535,"Perugia, Biblioteca Comunale, 1290; Full manuscript",f.1: Questo libro fu incominciato lanno di Cristo 1488 nel mese di agosto da suora Eufrasia figliuola di Alfano da Perugia,"f.1: This book was begun in the year of Christ 1488 in the month of August by Sister Eufrasia, daughter of Alfano from Perugia.",,Italy,12375,"Saint Maria de Monteluce, Benedictine, Monteluce (Monte Lucido), a suburb of Perugia, Italy, 1222"
25538,"Philadelphia, Free Library of Philadelphia, Lewis E 213; Full manuscript","Colophon f.118r (end of Augustine's Rule) lists eleven nuns and their confessor; 'Dit sijn der gheender namen die dit boexsken ghescreven hebben uut caritaten. Ons eerweerdighe pater heer Philips Nycholaes god sij sijn loen. Suster Beatrix Noeys, suster Margarete Bont, suster Janne van den Velde, suster Marie van Hansbeke, suster Katherie Tymmermans, suster Maria Meerts, suster Margarete Joerdaens, suster Janne Colijns, suster Anne Joerdaens, suster Rijckmoet van Zelken, suster Maergarete van den Rade. Int boeck des levens sij haerder alder name'. Free Library catalogue entry mentions 13 hand changes, but the last hand change covers the sermon (which may not be covered by the colophon)","Colophon f.118r (end of Augustine's Rule) lists eleven nuns and their confessor; ""This is the list of those whose names have written this booklet out of charity. Our honorable father, Mr. Philips Nycholaes, may God be his reward. Sister Beatrix Noeys, Sister Margarete Bont, Sister Janne van den Velde, Sister Marie van Hansbeke, Sister Katherie Tymmermans, Sister Maria Meerts, Sister Margarete Joerdaens, Sister Janne Colijns, Sister Anne Joerdaens, Sister Rijckmoet van Zelken, Sister Maergarete van den Rade. In the book of life, their names are all recorded.""
Free Library catalogue entry mentions 13 hand changes, but the last hand change covers the sermon (which may not be covered by the colophon)",15,Belgium,14016,"Cloister Notre-Dame of the Rose of Jericho, Augustinian, Brussels, Belgium, 1247"
25539,"Philadelphia, University of Pennsylvania, Ms.ex 655; Full manuscript","""Qui me scribebat nome(n) katherina mast habebat. Premia scriptricis. sint vite dona p(er)he(n)nis""","""The one who was writing me had the name Katherina Mast. May the rewards of the writer be the gifts of eternal life.""",15,Belgium,,
25541,"Pommersfelden, Gräfliche Schönbornsche Schlossbibliothek, 344; Full manuscript","f.184v-185r: ""Completus est iste libellus orarius anno domini M cccc lxxviii ipso die Sancti Ambrosii episcopi. Quem scripsit Soror Wendelmodis Roltemans ad instanciam carissime neptis eius Leve Ter Bruggen honeste matrone. Et Soror Agnes Martini illuminavit. Sancti moniales monasterii ordinis sancti Benedicti ad Sanctam Katharinam In Syloe prope Groenyncgen Urbem inclitam et opulentam in frysia. Eundem orarium prefata Leve Ter Bruggen tamquam entenium[?] memorabile propinando dedit illustri et honesto viro Johanni De Valle rosarum Alias Vanden Roesendael""","f.184v-185r: ""This little prayer book was completed in the year of our Lord 1478, on the very day of Saint Ambrose the Bishop. It was written by Sister Wendelmodis Roltemans at the request of her dear niece Leve Ter Bruggen, an honorable matron. And Sister Agnes Martini illuminated it. The holy nuns of the monastery of the Order of Saint Benedict at Saint Catherine in Syloe, near the renowned and prosperous city of Groningen in Friesland. The aforementioned Leve Ter Bruggen, as a memorable gift, gave this prayer book to the illustrious and honorable man John of the Valley of Roses, also known as Vanden Roesendael.""",15,Netherlands,,
25543,"Prague University, D.H. 120; Full manuscript",f.171: Amen. Dyss puch ist geschriben und volendt am abent des heiligen apostel und ewang. Mathei als man zalt nach Cristi gepurt unssers lieben herrn 1517 iar. Pytt got fur die schreiberyn swester Appolonia Polanderijn,"f.171: Amen. This book was written and completed on the evening of the Holy Apostle and Evangelist Matthew, as one counts from the birth of Christ our Lord in the year 1517. May God grant for the scribe, Sister Appolonia Pollanderin.",16,,,
25544,"Prague University, D.H.117; Full manuscript",f.312v: ...geschriben und vollendt mit der hilff Gotes am obent des heiligen Erczengels sant Michaelis als man schreib nach Cristi unssers lieben herren gepurt 1500 und in dem 14 jar... pit got fur die letzte schreiberin Appolonia Pollanderin... die ewigen seligkeit. Amen.,"f.312v: …written and completed with God’s help on the feast of the Holy Archangel Saint Michael, as one writes after the birth of our Lord Jesus Christ in the year 1500, and in the 14th year… May God grant the eternal bliss to the last scribe, Appolonia Pollanderin… Amen.",16,,,
25546,"Prague University, DH 132; Full manuscript","Dycz puch ist volent wurden an unser heylygen muter und haubtfrawen sant Claren tag, als sy erhebt ist wurden von einer swesster irs ordens. Got geb ir und uns all dy ewygen freud und das ewyg vaterlant, do alle wun und frewd ist an endt. Amen. (CMO 21732, Cmo VI/312)","This book was completed on our holy mother and lady, Saint Clare’s day, when she was elevated, by a sister of her order. May God grant her and all of us eternal joy and the eternal homeland, where all joy and happiness end. Amen.",15,,,
25547,"Prague University, DH 140; Full manuscript",... amen. amen. Margaretha von Schonbergk hat diss geschriben mit yrer lyncken hant. nemet vor gut libe Swester Juliana und bittet och got vor mich. amen.,… amen. amen. Margaretha von Schönbergk has written this with her left hand. She asks for the good sister Juliana and also prays to God for me. amen.,16,,,
25548,"Prague University, DH 148; Full manuscript",Wer disses puchlein vint der geb es durch got wider swester Angnes Keisserin oder swester Yrsala Wickersteterin der es auch peider ist. (f.99). Disse vorgeschriben predig hat uns swester Margaretta Gruntherin aptesin sant clar ordens von Nurnberg geschikt und begert von einer iden swester. einen. pater noster und ein ave maria der heiligen schar. das sie got fur sie piten. (f.127). Amen. Pitt got fur mich aller liebsten swester. (f.323).,"Whoever finds this little book, may they give it through God’s mercy to Sister Agnes Keisserin or Sister Yrsala Wickersteterin, who are both of them. (f.99).

This prescribed sermon was sent to us by Sister Margaretta Gruntherin, Abbess of the Order of Saint Clare of Nuremberg, who requested from a certain Sister a Pater Noster and an Ave Maria for the holy assembly, that she might pray to God for her. (f.127).

Amen. May God pray for me, my dearest sister. (f.323).",15,Germany,11438,"Saint Klara, Poor Clares, Nuremberg, Germany,-
1525"
25549,"Prague University, DH 159; Full manuscript","Hie ist ein end der regel sant Clarn swester. Regula te salvat, si servas que tibi narrat. Ein Swester die regel geschriben hat, da man zalt von cristus 1505 iar, geendet an sant Erhardi des heiligen pishoff, in Convent in Eger","Here is the end of the rule of the Saint Clare sisters. The rule saves you, if you keep what it tells you. A sister wrote the rule, in the year 1505 after the birth of Christ, finished on Saint Erhard’s Day, at the Holy Bishop’s, in the convent in Eger.",16,,,
25550,"Prague, Knihovna Metropolitni Kapituli, B IV 1; Full manuscript",f.174: Ego Birgitta filia Sighfusi soror conventualis in monasterio Munkalijff prope Bergis scripsi hunc psalterium cum litteris capitalibus licet minus bene quam debui orate pro peccatrice.,"“I, Birgitta, daughter of Sighfus, conventual sister in the monastery of Munkalijff near Bergen, wrote this psalter with capital letters, though not as well as I should have. Pray for the sinner.”",14,Germany,,
25553,"Prague, National Library of the Czech Republic, Ms. XVI.F.73; Full manuscript",f.69v,,,,,
25555,"Prague, National Museum, 3069; Full manuscript","f.175 ... von mir Catarina, Frau von Volkenstorf geb. Frau von Liechtenstein beschrieben.","f.175 … written by me, Catarina, Lady of Volkenstorf, née Lady of Liechtenstein.",16,,,
25557,"Prague, National Museum, ms. X A 12; Full manuscript",",f.359v lin blackl: Anno dni Augspurg lxxi / Clara Hatzlerin sb (scripsi).","“Year of the Lord [in] Augsburg, 1471 / Clara Hatzlerin wrote [this].”",15,Germany,,
22137,"Private Collection in Province of Vicenza, Ms.18; Full manuscript",f.45r: “Orate pro scriptrice sorore Samaritana de Calcagninis.”,"""Pray for the scribe, Sister Samaritana de Calcagninis.""",15,Italy,,
22211,"Rome, Biblioteca Nazionale Centrale, Varia 24 (574); Full manuscript","Questo libro si è scrito per mane/ de Lana de i Galvagni,/ fiola che fu de miser zan / Bertolameo. (Iesu) Maria.","This book was written by the hand of Lana de i Galvagni, daughter of the late Sir Zan Bertolameo. Jesus Mary.",16,Italy,,
22261,"Rome, Biblioteca Nazionale Centrale, Vittorio Emanuele 1335; Full manuscript",Finito el mio libro chiamato amor de carita. Scricto per man de me Giovanna de Piero di Martinozzi.,"Finished is my book called Amor de Carita. Written by the hand of me, Giovanna de Piero di Martinozzi.",15,,,
25578,"s-Hertogenbosch, Société provinciale des Arts et des Sciences, Ms.635; Full manuscript","f.179v: Finitus Anno Millesimo quadringentesimo lxxix. Per manu sororis Diewaris peregrini in festo sancti willibrordi confessoris. Et maxima pars scripta est in celebribus festis Orate pro ea. 
f.(garde): Liber magistri garlaci de scoten ad usum aduarie pauli monialis in beverwijck ad eiusdem vitam a prefato magistro aduarie concessus cum parte estivali etc.","f.179 verso: Finished in the year one thousand four hundred seventy-nine. By the hand of Sister Diewaris Peregrini on the feast of Saint Willibrord, confessor. And the majority of it was written on celebrated feast days. Pray for her.

Guard f.: The book of Master Garlacus de Scoten for the use of Sister Pauli, nun in Beverwijck, granted by the aforementioned Master Garlacus for her life, with the summer part, etc.",15,Netherlands,,
29165,"Saint-Omer. Bibliothèque d'agglomération, Ms. 414; Full manuscript","Priés bien Jesus et Marie pour seur Jehanne Brouxaut, votre indigne fille. Deo Gracias et Mariae.","Pray well to Jesus and Mary for Sister Jeanne Brouxaut, your unworthy daughter. Thanks be to God and to Mary",16,France,,
25614,"Salzburg Nonnberg Abbey, 23 D +16; Full manuscript",(profess st Peters 1518),,16,Austria,11532,"Petersfrauen, Benedictine, Salzburg, Austria, 1113-
1583"
25615,"Salzburg Nonnberg Abbey, 23 D +29; Full manuscript",(profess st Peters 1518),,15,Austria,11532,"Petersfrauen, Benedictine, Salzburg, Austria, 1113-
1583"
25617,"Salzburg Nonnberg Abbey, 28 D 3; Full manuscript",das puech hab ich schreibin lassen und geschemickt meinen liebn Swestern auff dem Nunburg Barbara Schedlingerin dye Zeitt Techanttin Anno domini [1490] Jar.,"This book I had written and sent to my beloved sister on the Nunburg, Barbara Schedlingerin, who at that time was a teacher, in the year of our Lord [1490].",15,Austria,,
25581,"Salzburg, Bibliothek St. Peter, a II 12; Full manuscript",Barbara Hubmerin dy hat das geschriben,"Barbara Hubmerin, she wrote this",15,Austria,11532,"Petersfrauen, Benedictine, Salzburg, Austria, 1113-
1583"
25582,"Salzburg, Bibliothek St. Peter, a II 17; Full manuscript",Hic est finis Erndrudis,Here is the end of Erndrudis,16,Austria,11532,"Petersfrauen, Benedictine, Salzburg, Austria, 1113-
1583"
22315,"Salzburg, Bibliothek St. Peter, a III 21; Full manuscript",mir parmherczichleich der du ymmer und ewichleich lebst amen amen.... Die puess psalm hat man ausgeschrieben am samcztag nach Petronell der heiligen junkchfrawn anno domino (!) Mccccxlviij jar Margret Hochenwarterin.,"Have mercy, you who live forever and eternally, amen, amen…. The penitential psalms were written out on the Saturday after St. Petronella, the holy virgin, in the year of the Lord 1448, by Margret Hochenwarterin.",15,Austria,11532,"Petersfrauen, Benedictine, Salzburg, Austria, 1113-
1583"
25586,"Salzburg, Bibliothek St. Peter, a IV 22, 5; Full manuscript",Hie hebt sich an ain andere betrachtung der mess gemacht von unser lieben frawn und swester Katherina Pschachlin.,"“Here begins another meditation on the Mass, composed by our dear lady and sister Katherina Pschachlin.""",16,Austria,11532,"Petersfrauen, Benedictine, Salzburg, Austria, 1113-
1583"
25587,"Salzburg, Bibliothek St. Peter, a IX 11; Full manuscript","[rubrics of ""cantrices"", calendar ""Betonung von Frauenfesten etc.]",,12,Austria,11532,"Petersfrauen, Benedictine, Salzburg, Austria, 1113-
1583"
25588,"Salzburg, Bibliothek St. Peter, a V 24; Full manuscript",[stems from Petersfrauen scriptorium],,12,Austria,11532,"Petersfrauen, Benedictine, Salzburg, Austria, 1113-
1583"
25589,"Salzburg, Bibliothek St. Peter, a VI 13; Full manuscript",scribles and sign VD and HD,,15,Austria,11532,"Petersfrauen, Benedictine, Salzburg, Austria, 1113-
1583"
